{
  "schema_version": "1.0.0",
  "session_id": "11111111-1111-4111-8111-111111111111",
  "trace_id": "22222222-2222-4222-8222-222222222222",
  "contract_version": "1.0.0",
  "trip_start_date": "2026-09-10",
  "trip_end_date": "2026-09-13",
  "available_local_time_minutes": 2400,
  "interests": ["history", "food"],
  "pace": "moderate",
  "language": "en",
  "mobility_constraints": [],
  "daily_activity_budget_minutes": 480,
  "stay_candidates": [
    { "candidate_id": "stay_001", "lat": 41.0055, "lon": 28.9769 },
    { "candidate_id": "stay_002", "lat": 41.0369, "lon": 28.9850 }
  ],
  "weather_context": { "forecast": "mild, no rain expected" },
  "hard_constraints": ["max_daily_walking_minutes<=180"],
  "soft_constraints": ["prefer_central_stay"]
}
